[
  {
    "id": "07-001",
    "stem": "Which compute option gives direct control of the guest operating system?",
    "choices": {
      "A": "Azure Container Instances",
      "B": "Azure App Service",
      "C": "Virtual machine",
      "D": "Azure Functions"
    },
    "answer": "C",
    "explanations": {
      "A": "ACI runs containers without customer VM administration.",
      "B": "App Service manages the underlying web platform.",
      "C": "A VM exposes guest OS configuration and maintenance.",
      "D": "Functions abstracts the host OS from the developer."
    },
    "objective_id": "A08",
    "remediation": "README.md#concept-primer",
    "source_urls": [
      "https://learn.microsoft.com/en-us/training/modules/describe-azure-compute-networking-services/",
      "https://learn.microsoft.com/en-us/azure/virtual-machines/overview",
      "https://learn.microsoft.com/en-us/azure/virtual-machine-scale-sets/overview",
      "https://learn.microsoft.com/en-us/azure/app-service/overview",
      "https://learn.microsoft.com/en-us/azure/container-instances/container-instances-overview"
    ],
    "difficulty": "foundational"
  },
  {
    "id": "07-002",
    "stem": "Which feature distinguishes containers from separate full VMs at a high level?",
    "choices": {
      "A": "Containers share a host kernel",
      "B": "Containers are finished business applications by definition",
      "C": "Containers never use operating systems",
      "D": "Each container must own a separate physical server"
    },
    "answer": "A",
    "explanations": {
      "A": "Containers package applications while sharing OS kernel infrastructure.",
      "B": "Packaging does not make an app SaaS.",
      "C": "They depend on a host kernel.",
      "D": "Container hosts can run multiple containers."
    },
    "objective_id": "A08",
    "remediation": "README.md#concept-primer",
    "source_urls": [
      "https://learn.microsoft.com/en-us/training/modules/describe-azure-compute-networking-services/",
      "https://learn.microsoft.com/en-us/azure/virtual-machines/overview",
      "https://learn.microsoft.com/en-us/azure/virtual-machine-scale-sets/overview",
      "https://learn.microsoft.com/en-us/azure/app-service/overview",
      "https://learn.microsoft.com/en-us/azure/container-instances/container-instances-overview"
    ],
    "difficulty": "applied"
  },
  {
    "id": "07-003",
    "stem": "A short task starts when a file arrives. Which compute approach naturally matches?",
    "choices": {
      "A": "Azure Virtual Desktop",
      "B": "Azure Functions",
      "C": "A permanently running manually managed desktop VM",
      "D": "An availability set"
    },
    "answer": "B",
    "explanations": {
      "A": "AVD supplies desktop/app access rather than this event abstraction.",
      "B": "Events can trigger function execution.",
      "C": "That adds continuous guest management for a short event.",
      "D": "A set groups VMs rather than executing event code."
    },
    "objective_id": "A08",
    "remediation": "README.md#concept-primer",
    "source_urls": [
      "https://learn.microsoft.com/en-us/training/modules/describe-azure-compute-networking-services/",
      "https://learn.microsoft.com/en-us/azure/virtual-machines/overview",
      "https://learn.microsoft.com/en-us/azure/virtual-machine-scale-sets/overview",
      "https://learn.microsoft.com/en-us/azure/app-service/overview",
      "https://learn.microsoft.com/en-us/azure/container-instances/container-instances-overview"
    ],
    "difficulty": "review"
  },
  {
    "id": "07-004",
    "stem": "What does Azure Container Instances offer?",
    "choices": {
      "A": "Managed execution of containers without managing VMs",
      "B": "A finished hosted email suite",
      "C": "An offline blob tier",
      "D": "A fleet of customer-managed desktop sessions"
    },
    "answer": "A",
    "explanations": {
      "A": "ACI abstracts the container host infrastructure.",
      "B": "That is a SaaS capability.",
      "C": "That is archive storage.",
      "D": "That is a virtual desktop scenario."
    },
    "objective_id": "A08",
    "remediation": "README.md#concept-primer",
    "source_urls": [
      "https://learn.microsoft.com/en-us/training/modules/describe-azure-compute-networking-services/",
      "https://learn.microsoft.com/en-us/azure/virtual-machines/overview",
      "https://learn.microsoft.com/en-us/azure/virtual-machine-scale-sets/overview",
      "https://learn.microsoft.com/en-us/azure/app-service/overview",
      "https://learn.microsoft.com/en-us/azure/container-instances/container-instances-overview"
    ],
    "difficulty": "foundational"
  },
  {
    "id": "07-005",
    "stem": "What is Azure Kubernetes Service primarily suited to?",
    "choices": {
      "A": "Orchestrating container workloads",
      "B": "Replacing all application data with email",
      "C": "Choosing a VM's guest password only",
      "D": "Serving as a storage access tier"
    },
    "answer": "A",
    "explanations": {
      "A": "AKS provides managed Kubernetes orchestration.",
      "B": "That is not container orchestration.",
      "C": "AKS manages broader container scheduling and operation.",
      "D": "AKS is compute orchestration."
    },
    "objective_id": "A08",
    "remediation": "README.md#concept-primer",
    "source_urls": [
      "https://learn.microsoft.com/en-us/training/modules/describe-azure-compute-networking-services/",
      "https://learn.microsoft.com/en-us/azure/virtual-machines/overview",
      "https://learn.microsoft.com/en-us/azure/virtual-machine-scale-sets/overview",
      "https://learn.microsoft.com/en-us/azure/app-service/overview",
      "https://learn.microsoft.com/en-us/azure/container-instances/container-instances-overview"
    ],
    "difficulty": "applied"
  },
  {
    "id": "07-006",
    "stem": "A container runs on a self-managed VM. Which conclusion is accurate?",
    "choices": {
      "A": "Microsoft necessarily patches every customer guest",
      "B": "Containers automatically make the host SaaS",
      "C": "No host exists after packaging",
      "D": "The customer still maintains the VM guest OS"
    },
    "answer": "D",
    "explanations": {
      "A": "Host and guest duties remain distinct.",
      "B": "Container packaging does not select service model.",
      "C": "Containers still need infrastructure.",
      "D": "Packaging does not transfer host responsibility."
    },
    "objective_id": "A08",
    "remediation": "README.md#concept-primer",
    "source_urls": [
      "https://learn.microsoft.com/en-us/training/modules/describe-azure-compute-networking-services/",
      "https://learn.microsoft.com/en-us/azure/virtual-machines/overview",
      "https://learn.microsoft.com/en-us/azure/virtual-machine-scale-sets/overview",
      "https://learn.microsoft.com/en-us/azure/app-service/overview",
      "https://learn.microsoft.com/en-us/azure/container-instances/container-instances-overview"
    ],
    "difficulty": "review"
  },
  {
    "id": "07-007",
    "stem": "What should guide a comparison of VMs, containers, and functions?",
    "choices": {
      "A": "Required control, packaging, event behavior, and operations",
      "B": "An assumption all three have identical billing",
      "C": "Only whether all three can execute code",
      "D": "An assumption all three require guest OS control"
    },
    "answer": "A",
    "explanations": {
      "A": "Workload needs determine the useful abstraction.",
      "B": "Plans and meters differ.",
      "C": "That does not distinguish their operational tradeoffs.",
      "D": "Managed services abstract that control."
    },
    "objective_id": "A08",
    "remediation": "README.md#concept-primer",
    "source_urls": [
      "https://learn.microsoft.com/en-us/training/modules/describe-azure-compute-networking-services/",
      "https://learn.microsoft.com/en-us/azure/virtual-machines/overview",
      "https://learn.microsoft.com/en-us/azure/virtual-machine-scale-sets/overview",
      "https://learn.microsoft.com/en-us/azure/app-service/overview",
      "https://learn.microsoft.com/en-us/azure/container-instances/container-instances-overview"
    ],
    "difficulty": "foundational"
  },
  {
    "id": "07-008",
    "stem": "Which statement about serverless functions is accurate?",
    "choices": {
      "A": "They use provider infrastructure while abstracting server operation",
      "B": "They eliminate application error handling",
      "C": "They run without any compute hardware",
      "D": "They always use the same billing model"
    },
    "answer": "A",
    "explanations": {
      "A": "Servers exist even when customers do not manage them.",
      "B": "Customer logic still needs resilience.",
      "C": "Physical compute remains necessary.",
      "D": "Hosting plans differ."
    },
    "objective_id": "A08",
    "remediation": "README.md#concept-primer",
    "source_urls": [
      "https://learn.microsoft.com/en-us/training/modules/describe-azure-compute-networking-services/",
      "https://learn.microsoft.com/en-us/azure/virtual-machines/overview",
      "https://learn.microsoft.com/en-us/azure/virtual-machine-scale-sets/overview",
      "https://learn.microsoft.com/en-us/azure/app-service/overview",
      "https://learn.microsoft.com/en-us/azure/container-instances/container-instances-overview"
    ],
    "difficulty": "applied"
  },
  {
    "id": "07-009",
    "stem": "What is a VM Scale Set designed to manage?",
    "choices": {
      "A": "A resource-group deletion lock only",
      "B": "A group of VM instances with scaling capabilities",
      "C": "A directory of external identities",
      "D": "A single storage account's archive tier"
    },
    "answer": "B",
    "explanations": {
      "A": "That is governance metadata.",
      "B": "Scale sets organize and scale instances.",
      "C": "That is identity management.",